input,output
"On a desk, there are three pens: a blue pen, a red pen, and a green pen. The green pen is to the right of the blue pen. The red pen is to the right of the green pen.Options:(A) The blue pen is the leftmost(B) The green pen is the leftmost(C) The red pen is the leftmost","(1) The green pen is to the right of the blue pen: ""(left) ? blue ? green ? (right)"".(2) The red pen is to the right of the green pen: ""(left) ? blue ? green red (right)"".(3) Combining (1) and (2) we get the following ordering: ""(left) blue green red (right)"".(4) According to this ordering, the leftmost pen is the blue pen.The blue pen is the leftmost. The answer is (A)."
"The following paragraphs each describe a set of three objects arranged in a fixed order. The statements are logically consistent within each paragraph. In a science lab, there are three scientific concepts: a theory, a law, and a hypothesis. The theory is more accepted than the hypothesis. The law is the most accepted and tested of the three.Options:(A) Theory, hypothesis, law(B) Hypothesis, law, theory(C) Theory, law, hypothesis(D) Hypothesis, theory, law","(1) The theory is more accepted than the hypothesis: ""(less accepted) ? hypothesis ? theory ? (more accepted)"".(2) The law is the most accepted and tested of the three: ""(less accepted) ? hypothesis ? theory ? law ? (most accepted)"".(3) Combining (1) and (2) we get the following ordering: ""(less accepted) hypothesis theory law (most accepted)"".
According to this ordering, the sequence from least to most accepted or tested is hypothesis, theory, law.The answer is (D) Hypothesis, theory, law."
"The following paragraphs each describe a set of three objects arranged in a fixed order. The statements are logically consistent within each paragraph. On a periodic table, there are three elements: a halogen, a noble gas, and an alkali metal. The noble gas is to the right of the halogen. The alkali metal is the rightmost.Options:(A) The halogen is the leftmost(B) The noble gas is the leftmost(C) The alkali metal is the leftmost","(1) The noble gas is to the right of the halogen: ""(left) ? halogen ? noble gas ? (right)"".(2) The alkali metal is the rightmost: ""(left) ? halogen ? noble gas alkali metal (right)"".(3) Combining (1) and (2) we get the following ordering: ""(left) halogen noble gas alkali metal (right)"".
According to this ordering, the leftmost element is the halogen.
The halogen is the leftmost. The answer is (A)."
"In a room, there are three chairs arranged in a row: a black chair, a white chair, and a gray chair. The white chair is to the left of the gray chair. The black chair is the second from the right.Options:(A) The black chair is the leftmost(B) The white chair is the leftmost(C) The gray chair is the leftmost","(1) The white chair is to the left of the gray chair: ""(left) ? white ? gray ? (right)"".(2) The black chair is the second from the right: ""(left) ? white black gray ? (right)"".(3) Combining (1) and (2) we get the following ordering: ""(left) white black gray (right)"".(4) According to this ordering, the leftmost chair is the white chair.The white chair is the leftmost. The answer is (B)."
"""The following paragraphs describe the positions of three paintings in an art gallery. The statements are logically consistent within each paragraph. On the west wall of the gallery, there are three paintings: a landscape, a portrait, and a still life. The portrait is to the right of the landscape. The still life is the rightmost painting.Options:(A) The landscape is the leftmost painting(B) The portrait is the leftmost painting(C) The still life is the leftmost painting""","""(1) The portrait is to the right of the landscape: ""(left) ? landscape ? portrait ? (right)"".(2) The still life is the rightmost painting: ""(left) ? landscape ? portrait still life (right)"".(3) Combining (1) and (2) we get the following ordering: ""(left) landscape portrait still life (right)"".According to this ordering, the leftmost painting is the landscape.The landscape is the leftmost painting. The answer is (A)."""
"""Three paintings are hanging on a wall: a landscape, a portrait, and a still life. The portrait is to the right of the landscape. The still life is to the right of the portrait.Options:(A) The landscape is the leftmost painting(B) The portrait is the leftmost painting(C) The still life is the leftmost painting""","""(1) The portrait is to the right of the landscape: ""(left) ? landscape ? portrait ? (right)"".(2) The still life is to the right of the portrait: ""(left) ? landscape ? portrait ? still life (right)"".(3) Combining (1) and (2) we get the following ordering: ""(left) landscape portrait still life (right)"".According to this ordering, the leftmost painting is the landscape.The landscape is the leftmost painting. The answer is (A)."""
"The following paragraphs each describe a set of three objects arranged in a fixed order. The statements are logically consistent within each paragraph. In a garden, there are three flowers: a sunflower, a daisy, and a rose. The daisy is to the left of the rose. The sunflower is the tallest.Options:(A) The sunflower is the leftmost flower(B) The daisy is the leftmost flower(C) The rose is the leftmost flower","(1) The daisy is to the left of the rose: ""(left) ? daisy ? rose ? (right)"".(2) The sunflower is the tallest: ""(shortest) ? daisy ? rose sunflower (tallest)"".(3) Combining (1) and (2) we get the following ordering: ""(left) daisy rose sunflower (right)"".(4) According to this ordering, the leftmost flower is the daisy.The daisy is the leftmost flower. The answer is (B)."
"The following paragraphs each describe a set of three objects arranged in a fixed order. The statements are logically consistent within each paragraph. On a kitchen counter, there are three fruits: an apple, an orange, and a banana. The orange is to the right of the apple. The banana is the leftmost fruit.Options:(A) The apple is the leftmost(B) The orange is the leftmost(C) The banana is the leftmost","(1) The orange is to the right of the apple: ""(left) ? apple ? orange ? (right)"".(2) The banana is the leftmost fruit: ""(left) banana apple ? orange ? (right)"".(3) Combining (1) and (2) we get the following ordering: ""(left) banana apple orange (right)"".
According to this ordering, the leftmost fruit is the banana.
The banana is the leftmost. The answer is (C)."
"""On a shelf, there are three fruits: an apple, a banana, and an orange. The banana is to the right of the apple. The orange is the leftmost.Options:(A) The apple is the leftmost(B) The banana is the leftmost(C) The orange is the leftmost""","""(1) The banana is to the right of the apple: ""(left) ? apple ? banana ? (right)"".(2) The orange is the leftmost: ""(left) orange ? apple ? banana (right)"".(3) Combining (1) and (2) we get the following ordering: ""(left) orange apple banana (right)"".According to this ordering, the leftmost fruit is the orange.The orange is the leftmost. The answer is (C)."""
"""In a computer science lab, there are three workstations arranged in a row. The leftmost workstation is running a Linux operating system, the middle workstation is running Windows, and the rightmost workstation is running macOS. The Linux workstation is to the left of the Windows workstation, and the macOS workstation is the rightmost.Options:(A) The Linux workstation is the leftmost(B) The Windows workstation is the leftmost(C) The macOS workstation is the leftmost""","""(1) The Linux workstation is to the left of the Windows workstation: ""(left) ? Linux ? Windows ? (right)"".(2) The macOS workstation is the rightmost: ""(left) ? Linux ? Windows macOS (right)"".(3) Combining (1) and (2) we get the following ordering: ""(left) Linux Windows macOS (right)"".According to this ordering, the leftmost workstation is the one running Linux.The Linux workstation is the leftmost. The answer is (A)."""
"On a shelf, there are three books: a red book, a gray book, and a blue book. The blue book is to the left of the gray book. The red book is the second from the right.Options:(A) The red book is the rightmost(B) The gray book is the rightmost(C) The blue book is the rightmost","(1) The blue book is to the left of the gray book: ""(left) ? blue ? gray ? (right)"".(2) The red book is the second from the right: ""(left) ? ? red gray ? (right)"".(3) Combining (1) and (2) we get the following ordering: ""(left) blue ? red gray (right)"".(4) According to this ordering, the rightmost book is the gray book.The gray book is the rightmost. The answer is (B)."
"""The following paragraphs each describe a set of three objects arranged in a fixed order. The statements are logically consistent within each paragraph. In a kitchen, there are three containers: a glass jar, a metal tin, and a plastic bowl. The metal tin is to the right of the glass jar. The plastic bowl is the leftmost container.Options:(A) The glass jar is the rightmost(B) The metal tin is the rightmost(C) The plastic bowl is the rightmost""","""(1) The plastic bowl is the leftmost container: ""(left) plastic ? jar ? tin (right)"".(2) The metal tin is to the right of the glass jar: ""(left) plastic ? jar tin (right)"".(3) Combining (1) and (2) we get the following ordering: ""(left) plastic jar tin (right)"".According to this ordering, the rightmost container is the metal tin.The metal tin is the rightmost. The answer is (B)."""
"The following paragraphs each describe a set of three objects arranged in a fixed order. The statements are logically consistent within each paragraph. In a biology laboratory, there are three types of cells: red blood cells, white blood cells, and platelets. White blood cells are larger than red blood cells. Platelets are smaller than red blood cells.Options:(A) Red blood cells are the largest(B) White blood cells are the largest(C) Platelets are the largest(D) I don't know","(1) White blood cells are larger than red blood cells: ""(smallest) ? red ? white ? (largest)"".(2) Platelets are smaller than red blood cells: ""(smallest) ? platelets ? red ? (largest)"".(3) Combining (1) and (2) we get the following ordering: ""(smallest) platelets red white (largest)"".
According to this ordering, the largest cell type is the white blood cell.
The answer is (B) White blood cells are the largest."
"""The following paragraphs each describe a set of three organisms arranged in a fixed order within a food web. The statements are logically consistent within each paragraph. In a typical food web, there are three organisms: a field mouse, an eagle, and a rabbit. The eagle preys on the rabbit. The rabbit eats the algae.Options:(A) The field mouse is the top predator(B) The eagle is the top predator(C) The rabbit is the top predator""","""(1) The eagle preys on the rabbit: ""(above) ? eagle ? rabbit ? (below)"".(2) The rabbit eats the algae: ""(above) ? rabbit ? algae ? (below)"".(3) Combining (1) and (2) we get the following ordering: ""(above) eagle rabbit algae (below)"".According to this ordering, the top predator is the eagle.The eagle is the top predator. The answer is (B)."""
"""On a table, there are three objects: a cube, a sphere, and a cylinder. The sphere is to the right of the cube. The cylinder is the leftmost object.Options:(A) The cube is the leftmost(B) The sphere is the leftmost(C) The cylinder is the leftmost""","""(1) The cylinder is the leftmost object: ""(left) cylinder ? ? (right)"".(2) The sphere is to the right of the cube: ""(left) ? cube sphere ? (right)"".(3) Combining (1) and (2) we get the following ordering: ""(left) cylinder cube sphere (right)"".According to this ordering, the leftmost object is the cylinder.The cylinder is the leftmost. The answer is (C)."""
"The following paragraphs each describe a set of three geometric shapes arranged in a fixed order. The statements are logically consistent within each paragraph. On a table, there are three shapes: a circle, a square, and a triangle. The square is to the right of the circle. The triangle is the leftmost shape.Options:(A) The circle is the leftmost shape(B) The square is the leftmost shape(C) The triangle is the leftmost shape","(1) The square is to the right of the circle: ""(left) ? circle ? square ? (right)"".(2) The triangle is the leftmost shape: ""(left) triangle ? circle ? square (right)"".(3) Combining (1) and (2) we get the following ordering: ""(left) triangle circle square (right)"".
According to this ordering, the leftmost shape is the triangle.
The triangle is the leftmost. The answer is (C)."
"In a basketball tournament, there were three teams: Atlanta, Boston, and Chicago. Atlanta dominated the series, winning all four games. In total, they had a lead of 77 points across all the games. Based on this information, which team finished last?

Options:
(A) Atlanta
(B) Boston
(C) Chicago","(1) Atlanta dominated the series, winning all four games: Atlanta is the team that finished first.
(2) Atlanta had a total lead of 77 points across all the games: Atlanta is the team that finished first, and the team with the largest lead.
(3) Combining (1) and (2), we can deduce that the team that finished last is the team that had the smallest lead, which is Chicago.

The answer is (C) Chicago."
"The following paragraphs each describe a set of three objects arranged in a fixed order. The statements are logically consistent within each paragraph. On a shelf, there are three snack items: peanuts, sunflower seeds, and raisins. The sunflower seeds are to the right of the peanuts. The raisins are the rightmost item.Options:(A) The peanuts are the leftmost item(B) The sunflower seeds are the leftmost item(C) The raisins are the leftmost item","(1) The sunflower seeds are to the right of the peanuts: ""(left) ? peanuts ? sunflower seeds ? (right)"".(2) The raisins are the rightmost item: ""(left) ? peanuts ? sunflower seeds raisins (right)"".(3) Combining (1) and (2) we get the following ordering: ""(left) peanuts sunflower seeds raisins (right)"".
According to this ordering, the leftmost item is the peanuts.The peanuts are the leftmost item. The answer is (A)."
"On a shelf, there are three figurines: a ceramic elephant, a wooden giraffe, and a glass dolphin. The ceramic elephant is to the left of the wooden giraffe. The glass dolphin is the rightmost figurine.Options:(A) The ceramic elephant is the leftmost figurine(B) The wooden giraffe is the leftmost figurine(C) The glass dolphin is the leftmost figurine","(1) The ceramic elephant is to the left of the wooden giraffe: ""(left) ? ceramic elephant ? wooden giraffe ? (right)"".(2) The glass dolphin is the rightmost figurine: ""(left) ? ceramic elephant ? wooden giraffe glass dolphin (right)"".(3) Combining (1) and (2) we get the following ordering: ""(left) ceramic elephant wooden giraffe glass dolphin (right)"".
According to this ordering, the leftmost figurine is the ceramic elephant.
The ceramic elephant is the leftmost figurine. The answer is (A)."
"On a table, there are three objects: a cube, a sphere, and a cylinder. The cube is to the left of the sphere. The cylinder is the rightmost object.Options:(A) The cube is the leftmost object(B) The sphere is the leftmost object(C) The cylinder is the leftmost object","(1) The cube is to the left of the sphere: ""(left) ? cube ? sphere ? (right)"".(2) The cylinder is the rightmost object: ""(left) ? cube ? sphere cylinder (right)"".(3) Combining (1) and (2) we get the following ordering: ""(left) cube sphere cylinder (right)"".
According to this ordering, the leftmost object is the cube.
The cube is the leftmost object. The answer is (A)."
"On a kitchen counter, there are three food items: a lemon, an apple, and a tomato. The tomato is to the right of the lemon. The apple is the middle item.Options:(A) The lemon is the leftmost item(B) The apple is the leftmost item(C) The tomato is the leftmost item","(1) The tomato is to the right of the lemon: ""(left) ? lemon ? tomato ? (right)"".(2) The apple is the middle item: ""(left) ? lemon apple tomato ? (right)"".(3) Combining (1) and (2) we get the following ordering: ""(left) lemon apple tomato (right)"".
According to this ordering, the leftmost item is the lemon.The lemon is the leftmost item. The answer is (A)."
"""In an economics experiment, there are three variables: income, consumption, and savings. The following statements describe the relationships between these variables:
Consumption is directly proportional to income. Savings is inversely proportional to consumption.
Options:
(A) Income is the independent variable, consumption is the dependent variable, and savings is the dependent variable.
(B) Consumption is the independent variable, income is the dependent variable, and savings is the dependent variable. 
(C) Savings is the independent variable, income is the dependent variable, and consumption is the dependent variable.
(D) Income is the independent variable, savings is the dependent variable, and consumption is the dependent variable.""","""(1) Consumption is directly proportional to income: ""(above) ? income ? consumption ? (below)"".
(2) Savings is inversely proportional to consumption: ""(above) ? consumption ? savings ? (below)"".
(3) Combining (1) and (2) we get the following ordering: ""(above) income consumption savings (below)"".
According to this ordering, income is the independent variable, consumption is the dependent variable, and savings is the dependent variable.
The answer is (A)."""
"""In a school's art gallery, there are three paintings displayed: a landscape, a portrait, and a still life. The landscape is to the left of the portrait. The still life is to the right of the portrait.Options:(A) The landscape is the leftmost painting(B) The portrait is the leftmost painting(C) The still life is the leftmost painting""","""(1) The landscape is to the left of the portrait: ""(left) ? landscape ? portrait ? (right)"".(2) The still life is to the right of the portrait: ""(left) ? landscape ? portrait ? still life (right)"".(3) Combining (1) and (2) we get the following ordering: ""(left) landscape portrait still life (right)"".According to this ordering, the leftmost painting is the landscape.The landscape is the leftmost painting. The answer is (A)."""
"The following paragraphs each describe a set of three objects arranged in a fixed order. The statements are logically consistent within each paragraph. In a bakery, there are three cakes: a chocolate cake, a vanilla cake, and a strawberry cake. The chocolate cake is to the left of the vanilla cake. The strawberry cake is the rightmost.Options:(A) The chocolate cake is the leftmost(B) The vanilla cake is the leftmost(C) The strawberry cake is the leftmost","(1) The chocolate cake is to the left of the vanilla cake: ""(left) ? chocolate ? vanilla ? (right)"".(2) The strawberry cake is the rightmost: ""(left) ? chocolate ? vanilla strawberry (right)"".(3) Combining (1) and (2) we get the following ordering: ""(left) chocolate vanilla strawberry (right)"".According to this ordering, the leftmost cake is the chocolate cake.The chocolate cake is the leftmost. The answer is (A)."
"""In a shop, there are three types of pens: blue, red, and green. The red pen is to the left of the blue pen. The green pen is the rightmost.Options:(A) The blue pen is the leftmost(B) The red pen is the leftmost(C) The green pen is the leftmost""","""(1) The red pen is to the left of the blue pen: \""(left) ? red ? blue ? (right)\"".(2) The green pen is the rightmost: \""(left) ? red ? blue green (right)\"".(3) Combining (1) and (2) we get the following ordering: \""(left) red blue green (right)\"".\nAccording to this ordering, the leftmost pen is the red pen.\nThe red pen is the leftmost. The answer is (B)."""
"In a room, there are three different types of lamps: a table lamp, a floor lamp, and a wall lamp. The table lamp is to the left of the floor lamp. The wall lamp is the rightmost lamp.Options:(A) The table lamp is the leftmost(B) The floor lamp is the leftmost(C) The wall lamp is the leftmost","(1) The table lamp is to the left of the floor lamp: ""(left) ? table ? floor ? (right)"".(2) The wall lamp is the rightmost: ""(left) ? table ? floor wall (right)"".(3) Combining (1) and (2) we get the following ordering: ""(left) table floor wall (right)"".
According to this ordering, the leftmost lamp is the table lamp.
The table lamp is the leftmost. The answer is (A)."
"""In a garden, there are three flower pots arranged in a row. The pot on the left contains a red flower, the middle pot contains a white flower, and the pot on the right contains a yellow flower. The red flower is taller than the white flower, and the yellow flower is the shortest of the three.Options:(A) The red flower is the tallest(B) The white flower is the tallest(C) The yellow flower is the tallest""","""(1) The red flower is taller than the white flower: ""(tall) ? red ? white ? (short)"".(2) The yellow flower is the shortest: ""(tall) ? red ? white ? yellow (short)"".(3) Combining (1) and (2) we get the following ordering: ""(tall) red white yellow (short)"".According to this ordering, the tallest flower is the red flower.The red flower is the tallest. The answer is (A)."""
"""In a garden, there are 3 rows of fruit trees. The first row has 5 apple trees, the second row has 3 orange trees, and the third row has 4 pear trees. The trees in each row are evenly spaced. Options: (A) The apple trees are leftmost, (B) The orange trees are leftmost, (C) The pear trees are leftmost""","""(1) The first row has 5 apple trees: ""(left) ? apple apple apple apple apple ? (right)"".(2) The second row has 3 orange trees: ""(left) ? orange orange orange ? (right)"".(3) The third row has 4 pear trees: ""(left) ? pear pear pear pear ? (right)"".(4) Combining (1), (2), and (3) we get the following ordering: ""(left) apple apple apple apple apple orange orange orange pear pear pear pear (right)"".(5) According to this ordering, the leftmost trees are the apple trees.The apple trees are leftmost. The answer is (A)."""
"The following paragraphs each describe a set of three vehicles arranged in a fixed order. The statements are logically consistent within each paragraph. A truck covers a distance of 550 meters in 1 minute, whereas a bus covers a distance of 33 kilometers in 45 minutes. What is the ratio of their speeds?Options:(A) 1 : 2(B) 3 : 4(C) 2 : 5(D) 3 : 7(E) 1 : 3","(1) The truck covers a distance of 550 meters in 1 minute, which means its speed is 550 meters per minute or 9.17 meters per second.(2) The bus covers a distance of 33 kilometers in 45 minutes, which means its speed is 33 kilometers per 45 minutes or 0.73 kilometers per minute or 0.73 * 1000 = 730 meters per minute or 12.17 meters per second.(3) The ratio of their speeds is 9.17 : 12.17 = 3 : 4.The answer is (B) 3 : 4."
"There are three toys on a shelf: a red ball, a blue cube, and a green cylinder. The blue cube is to the right of the red ball. The green cylinder is to the right of the blue cube. Options:(A) The red ball is the leftmost(B) The blue cube is the leftmost(C) The green cylinder is the leftmost","(1) The blue cube is to the right of the red ball: ""(left) ? red ball ? blue cube ? (right)"".(2) The green cylinder is to the right of the blue cube: ""(left) ? red ball ? blue cube green cylinder (right)"".(3) Combining (1) and (2) we get the following ordering: ""(left) red ball blue cube green cylinder (right)"".(4) According to this ordering, the leftmost toy is the red ball.The red ball is the leftmost. The answer is (A)."
"""In a museum, there are three paintings displayed in a row: a landscape, a portrait, and a still life. The landscape is to the left of the portrait, and the still life is to the right of the portrait.Options:(A) The landscape is the leftmost painting(B) The portrait is the leftmost painting(C) The still life is the leftmost painting""","""(1) The landscape is to the left of the portrait: ""(left) ? landscape ? portrait ? (right)"".(2) The still life is to the right of the portrait: ""(left) ? landscape ? portrait ? still life (right)"".(3) Combining (1) and (2) we get the following ordering: ""(left) landscape portrait still life (right)"".According to this ordering, the leftmost painting is the landscape.The landscape is the leftmost painting. The answer is (A)."""
"""The following paragraphs each describe a set of three objects arranged in a fixed order. The statements are logically consistent within each paragraph. There are three cakes on a table: a chocolate cake, a vanilla cake, and a strawberry cake. The chocolate cake is to the left of the vanilla cake. The strawberry cake is the rightmost.Options:(A) The chocolate cake is the leftmost(B) The vanilla cake is the leftmost(C) The strawberry cake is the leftmost""","""(1) The chocolate cake is to the left of the vanilla cake: \""(left) ? chocolate ? vanilla ? (right)\"".(2) The strawberry cake is the rightmost: \""(left) ? chocolate ? vanilla strawberry (right)\"".(3) Combining (1) and (2) we get the following ordering: \""(left) chocolate vanilla strawberry (right)\"".\nAccording to this ordering, the leftmost cake is the chocolate cake.\nThe chocolate cake is the leftmost. The answer is (A)."""
