input,output
"There are 10 books on a shelf, of which 4 are paperbacks and 6 are hardbacks. How many possible selections of 5 books from the shelf contain at least one paperback and at least one hardback?","(1) There are 4 paperbacks and 6 hardbacks, so the total number of books is 10.(2) We want to select 5 books from the 10 books, and at least one of them must be a paperback and at least one must be a hardback.(3) The possible combinations are:(a) 1 paperback and 4 hardbacks(b) 4 paperbacks and 1 hardback(c) 2 paperbacks and 3 hardbacks(d) 3 paperbacks and 2 hardbacks(4) Calculating the number of combinations for each case:(a) 1 paperback and 4 hardbacks: 4C1 * 6C4 = 60(b) 4 paperbacks and 1 hardback: 4C4 * 6C1 = 6(c) 2 paperbacks and 3 hardbacks: 4C2 * 6C3 = 120(d) 3 paperbacks and 2 hardbacks: 4C3 * 6C2 = 60(5) Summing up the combinations: 60 + 6 + 120 + 60 = 246.The answer is (d) 246."
"In a museum, there are three paintings arranged in a row: a landscape painting, a portrait painting, and a still-life painting. The portrait painting is to the right of the landscape painting. The still-life painting is the leftmost painting.Options:(A) The landscape painting is the leftmost(B) The portrait painting is the leftmost(C) The still-life painting is the leftmost","(1) The portrait painting is to the right of the landscape painting: ""(left) ? landscape ? portrait ? (right)"".(2) The still-life painting is the leftmost: ""(left) still-life ? landscape ? portrait (right)"".(3) Combining (1) and (2) we get the following ordering: ""(left) still-life landscape portrait (right)"".
According to this ordering, the leftmost painting is the still-life painting.
The still-life painting is the leftmost. The answer is (C)."
"The following paragraphs each describe a set of three objects arranged in a fixed order. The statements are logically consistent within each paragraph. In a restaurant, there are three dishes: a spicy dish, a sour dish, and a sweet dish. The sour dish is to the left of the sweet dish. The spicy dish is in the middle.Options:(A) The spicy dish is the leftmost(B) The sour dish is the leftmost(C) The sweet dish is the leftmost","(1) The sour dish is to the left of the sweet dish: ""(left) ? sour ? sweet ? (right)"".(2) The spicy dish is in the middle: ""(left) ? sour spicy sweet ? (right)"".(3) Combining (1) and (2) we get the following ordering: ""(left) sour spicy sweet (right)"".
According to this ordering, the leftmost dish is the sour dish.
The sour dish is the leftmost. The answer is (B)."
"The following paragraphs each describe a set of three objects arranged in a fixed order. The statements are logically consistent within each paragraph. In a zoo, there are three types of animals: a lion, a giraffe, and a penguin. The giraffe is taller than the lion. The penguin is shorter than the lion.Options:(A) The lion is the tallest(B) The giraffe is the tallest(C) The penguin is the tallest","(1) The giraffe is taller than the lion: ""(short) ? lion ? giraffe ? (tall)"".(2) The penguin is shorter than the lion: ""(tall) ? lion ? penguin ? (short)"".(3) Combining (1) and (2) we get the following ordering: ""(tall) giraffe lion penguin (short)"".
According to this ordering, the tallest animal is the giraffe.
The giraffe is the tallest. The answer is (B)."
"On a table, there are three objects: a blue cube, a red sphere, and a green pyramid. The blue cube is to the left of the red sphere. The green pyramid is the rightmost object.Options:(A) The blue cube is the leftmost object(B) The red sphere is the leftmost object(C) The green pyramid is the leftmost object","(1) The blue cube is to the left of the red sphere: ""(left) ? blue cube ? red sphere ? (right)"".(2) The green pyramid is the rightmost object: ""(left) ? blue cube ? red sphere green pyramid (right)"".(3) Combining (1) and (2) we get the following ordering: ""(left) blue cube red sphere green pyramid (right)"".
According to this ordering, the leftmost object is the blue cube.
The blue cube is the leftmost object. The answer is (A)."
"There are three pieces of furniture in a room: a couch, a chair, and a table. The chair is to the left of the table. The couch is to the right of the chair. Options:(A) The table is the leftmost piece of furniture(B) The chair is the leftmost piece of furniture(C) The couch is the leftmost piece of furniture","(1) The chair is to the left of the table: ""(left) ? chair ? table ? (right)"".(2) The couch is to the right of the chair: ""(left) ? chair ? couch ? (right)"".(3) Combining (1) and (2) we get the following ordering: ""(left) chair table couch (right)"".
According to this ordering, the leftmost piece of furniture is the chair.
The chair is the leftmost. The answer is (B)."
"""The following paragraphs each describe a set of three objects arranged in a fixed order. The statements are logically consistent within each paragraph. On a hot sunny day, a cupful of water and a similar cupful of gasoline were placed on a table near a window. A few hours later, it was observed that both the cups had less liquid in them, but there was less gasoline left than water.Options:(A) All liquids evaporate.(B) Gasoline gets hotter than water.(C) Some liquids evaporate faster than others.(D) Liquids will only evaporate in sunshine.(E) Water gets hotter than gasoline.""","""(1) The cups had less liquid in them, but there was less gasoline left than water: ""(above) ? water ? gasoline ? (below)"".(2) This indicates that gasoline evaporated faster than water.Combining (1) and (2), we can conclude that some liquids evaporate faster than others.The answer is (C) Some liquids evaporate faster than others."""
"There are three beakers on a table, labeled A, B, and C. Beaker A contains a 30% salt solution, Beaker B contains a 60% salt solution, and Beaker C is empty. If 100 mL of the 30% salt solution from Beaker A is poured into the empty Beaker C, and then 100 mL of the 60% salt solution from Beaker B is poured into Beaker C, what is the final concentration of the salt solution in Beaker C?Options:(A) 45%(B) 50%(C) 55%(D) 60%","(1) Beaker A contains a 30% salt solution, and 100 mL of this is poured into the empty Beaker C. So the concentration in Beaker C is now 30%.(2) Beaker B contains a 60% salt solution, and 100 mL of this is then poured into Beaker C, which already contains 100 mL of a 30% salt solution. To find the final concentration, we can use the formula: (Concentration1 * Volume1 + Concentration2 * Volume2) / (Volume1 + Volume2).(3) Plugging in the values, we get: (30% * 100 mL + 60% * 100 mL) / (100 mL + 100 mL) = (3000 + 6000) / 200 = 45%.The final concentration of the salt solution in Beaker C is 45%. The answer is (A)."
"""In a business venture, two partners, X and Y, invested different amounts of money. X invested Rs. 52,000 at the start, while Y joined the business after 6 months and invested Rs. 26,000. What is the ratio in which they should share the profit at the end of the year?""","""(1) X invested Rs. 52,000 at the start: ""(above) ? X ? (below)"".(2) Y joined the business after 6 months and invested Rs. 26,000: ""(above) ? X ? Y ? (below)"".(3) Combining (1) and (2) we get the following investments and time periods: X invested Rs. 52,000 for 12 months, and Y invested Rs. 26,000 for 6 months.(4) The ratio in which they should share the profit is proportional to the product of their investments and the time periods: X's investment * X's time period : Y's investment * Y's time period = (52,000 * 12) : (26,000 * 6) = 624,000 : 156,000 = 4 : 1.The answer is (D) 4 : 1."""
"In a museum, there are three paintings arranged in a specific order. The painting on the left is a landscape, the painting in the middle is a portrait, and the painting on the right is a still life. The portrait is to the right of the landscape. The still life is the rightmost painting.Options:(A) The landscape is the leftmost painting(B) The portrait is the leftmost painting(C) The still life is the leftmost painting","(1) The portrait is to the right of the landscape: ""(left) ? landscape ? portrait ? (right)"".(2) The still life is the rightmost painting: ""(left) ? landscape ? portrait still life (right)"".(3) Combining (1) and (2) we get the following ordering: ""(left) landscape portrait still life (right)"".
According to this ordering, the leftmost painting is the landscape.The landscape is the leftmost painting. The answer is (A)."
"In a collection of three books, the first book is a classic Arabic textbook. The second book is a reference book, and the third book is a dictionary. The classic Arabic textbook is to the left of the reference book. The dictionary is to the right of the reference book.Options:(A) The classic Arabic textbook is the leftmost book(B) The reference book is the leftmost book(C) The dictionary is the leftmost book","(1) The classic Arabic textbook is to the left of the reference book: ""(left) ? classic Arabic textbook ? reference book ? (right)"".(2) The dictionary is to the right of the reference book: ""(left) ? classic Arabic textbook ? reference book dictionary (right)"".(3) Combining (1) and (2) we get the following ordering: ""(left) classic Arabic textbook reference book dictionary (right)"".(4) According to this ordering, the leftmost book is the classic Arabic textbook.The classic Arabic textbook is the leftmost book. The answer is (A)."
"The following paragraphs each describe a set of three objects arranged in a fixed order. The statements are logically consistent within each paragraph. In a classroom, there are three desks: a red desk, a blue desk, and a green desk. The blue desk is to the right of the red desk. The green desk is the leftmost.Options:(A) The red desk is the leftmost(B) The blue desk is the leftmost(C) The green desk is the leftmost","(1) The blue desk is to the right of the red desk: ""(left) ? red ? blue ? (right)"".(2) The green desk is the leftmost: ""(left) green ? red ? blue ? (right)"".(3) Combining (1) and (2) we get the following ordering: ""(left) green red blue (right)"".
According to this ordering, the leftmost desk is the green desk.
The green desk is the leftmost. The answer is (C)."
"""In a museum, there are three paintings arranged in a specific order. The first painting is a landscape, the second painting is a portrait, and the third painting is a still life. The portrait painting is to the right of the landscape painting. The still life painting is the rightmost.Options:(A) The landscape painting is the leftmost(B) The portrait painting is the leftmost(C) The still life painting is the leftmost""","""(1) The portrait painting is to the right of the landscape painting: \""(left) ? landscape ? portrait ? (right)\"".(2) The still life painting is the rightmost: \""(left) ? landscape ? portrait still life (right)\"".(3) Combining (1) and (2) we get the following ordering: \""(left) landscape portrait still life (right)\"".\nAccording to this ordering, the leftmost painting is the landscape painting.\nThe landscape painting is the leftmost. The answer is (A)."""
"Three friends, Alice, Bob, and Charlie, are standing in a line. Alice is to the left of Bob, and Bob is to the left of Charlie. Which of the following options correctly represents the order of the three friends from left to right?","(1) Alice is to the left of Bob: ""(left) ? Alice ? Bob ? (right)""
(2) Bob is to the left of Charlie: ""(left) ? Alice ? Bob ? Charlie (right)""
(3) Combining (1) and (2) we get the following ordering: ""(left) Alice Bob Charlie (right)""
According to this ordering, the person who is the leftmost is Alice.
The answer is (A) Alice is the leftmost."
The following paragraphs each describe a set of three objects arranged in a fixed order. The statements are logically consistent within each paragraph. Tamara bought a skate and a set for making. The skate is to the left of the set. The set is the rightmost.Options:(A) The skate is the leftmost(B) The set is the leftmost(C) The skate and set are both in the middle,"(1) The skate is to the left of the set: ""(left) ? skate ? set ? (right)"".(2) The set is the rightmost: ""(left) ? skate ? set (right)"".(3) Combining (1) and (2) we get the following ordering: ""(left) skate set (right)"".
According to this ordering, the leftmost object is the skate.The skate is the leftmost. The answer is (A)."
"Tamara bought a skateboard and a set of protective gear. The skateboard is red, the helmet is blue, and the pads are green. The helmet is to the left of the skateboard, and the pads are to the right of the skateboard.Options:(A) The red skateboard is the leftmost(B) The blue helmet is the leftmost(C) The green pads are the leftmost","(1) The helmet is to the left of the skateboard: ""(left) ? helmet ? skateboard ? (right)"".(2) The pads are to the right of the skateboard: ""(left) ? helmet skateboard ? pads (right)"".(3) Combining (1) and (2) we get the following ordering: ""(left) helmet skateboard pads (right)"".According to this ordering, the leftmost item is the blue helmet.The blue helmet is the leftmost. The answer is (B)."
"""On a table, there are three pieces of fruit: an apple, a banana, and an orange. The banana is to the left of the orange. The apple is the leftmost.Options:(A) The banana is the leftmost(B) The orange is the leftmost(C) The apple is the leftmost""","""(1) The banana is to the left of the orange: ""(left) ? banana ? orange ? (right)"".(2) The apple is the leftmost: ""(left) apple ? banana ? orange (right)"".(3) Combining (1) and (2) we get the following ordering: ""(left) apple banana orange (right)"".According to this ordering, the leftmost piece of fruit is the apple.The apple is the leftmost. The answer is (C)."""
"The following paragraphs each describe a set of three objects arranged in a fixed order. The statements are logically consistent within each paragraph. On a shelf, there are three Arabic words: '#غرد_وكأنك_المنظم', 'خصوصيات', and 'عبدالله'. The word 'خصوصيات' is to the right of the word '#غرد_وكأنك_المنظم'. The word 'عبدالله' is the rightmost.Options:(A) The word '#غرد_وكأنك_المنظم' is the leftmost(B) The word 'خصوصيات' is the leftmost(C) The word 'عبدالله' is the leftmost","(1) The word 'خصوصيات' is to the right of the word '#غرد_وكأنك_المنظم': ""(left) ? #غرد_وكأنك_المنظم ? خصوصيات ? (right)"".(2) The word 'عبدالله' is the rightmost: ""(left) ? #غرد_وكأنك_المنظم ? خصوصيات عبدالله (right)"".(3) Combining (1) and (2) we get the following ordering: ""(left) #غرد_وكأنك_المنظم خصوصيات عبدالله (right)"".According to this ordering, the leftmost word is '#غرد_وكأنك_المنظم'.The word '#غرد_وكأنك_المنظم' is the leftmost. The answer is (A)."
"""On a table, there are three objects: a red cube, a blue sphere, and a green pyramid. The blue sphere is to the right of the red cube. The green pyramid is the leftmost object.Options:(A) The red cube is the leftmost(B) The blue sphere is the leftmost(C) The green pyramid is the leftmost""","""(1) The blue sphere is to the right of the red cube: ""(left) ? red cube ? blue sphere ? (right)"".(2) The green pyramid is the leftmost object: ""(left) green pyramid ? red cube ? blue sphere (right)"".(3) Combining (1) and (2) we get the following ordering: ""(left) green pyramid red cube blue sphere (right)"".According to this ordering, the leftmost object is the green pyramid.The green pyramid is the leftmost. The answer is (C)."""
"""The following paragraphs each describe a set of three objects arranged in a fixed order. The statements are logically consistent within each paragraph. In a garden, there are three flower pots: a red pot, a blue pot, and a yellow pot. The blue pot is to the left of the yellow pot. The red pot is in the middle.Options:(A) The red pot is the leftmost(B) The blue pot is the leftmost(C) The yellow pot is the leftmost""","""(1) The blue pot is to the left of the yellow pot: ""(left) ? blue ? yellow ? (right)"".(2) The red pot is in the middle: ""(left) ? blue red yellow ? (right)"".(3) Combining (1) and (2) we get the following ordering: ""(left) blue red yellow (right)"".According to this ordering, the leftmost pot is the blue pot.The blue pot is the leftmost. The answer is (B)."""
"""In a room, there are three chairs: a red chair, a blue chair, and a green chair. The blue chair is to the right of the red chair. The green chair is the leftmost.Options:(A) The red chair is the leftmost(B) The blue chair is the leftmost(C) The green chair is the leftmost""","""(1) The blue chair is to the right of the red chair: ""(left) ? red ? blue ? (right)"".(2) The green chair is the leftmost: ""(left) green ? red ? blue ? (right)"".(3) Combining (1) and (2) we get the following ordering: ""(left) green red blue (right)"".According to this ordering, the leftmost chair is the green chair.The green chair is the leftmost. The answer is (C)."""
"""The following paragraphs each describe a set of three objects arranged in a fixed order. The statements are logically consistent within each paragraph. A and B are two people whose present ages are in the ratio of 6:3. The ratio between A's age 4 years ago and B's age 4 years hence is 1:1. What is the ratio between A's age 4 years hence and B's age 4 years ago?Options:(A) 5:4(B) 3:0(C) 5:1(D) 3:2(E) 3:7""","""(1) The ratio between the present ages of A and B is 6:3: ""(present) ? A(6x) ? B(3x) ? (present)"".(2) The ratio between A's age 4 years ago and B's age 4 years hence is 1:1: ""(4 years ago) ? A(6x-4) ? B(3x+4) ? (4 years hence)"".(3) Combining (1) and (2) we get: 6x = 8, x = 2.67.(4) The ratio between A's age 4 years hence and B's age 4 years ago is (5x+4):(3x-4) = 20:4 = 5:1.The answer is (C) 5:1."""
"The following paragraphs each describe a set of three objects arranged in a fixed order. The statements are logically consistent within each paragraph. In a chemistry lab, there are three elements: hydrogen, helium, and lithium. Hydrogen is the lightest element. Lithium is heavier than helium.Options:(A) Hydrogen is the lightest element(B) Helium is the lightest element(C) Lithium is the lightest element","(1) Hydrogen is the lightest element: ""(light) ? hydrogen ? helium ? lithium (heavy)"".(2) Lithium is heavier than helium: ""(light) ? hydrogen ? helium ? lithium (heavy)"".(3) Combining (1) and (2) we get the following ordering: ""(light) hydrogen helium lithium (heavy)"".
According to this ordering, the lightest element is hydrogen.
Hydrogen is the lightest element. The answer is (A)."
"The following paragraphs each describe a set of three objects arranged in a fixed order. The statements are logically consistent within each paragraph. A scientist is examining three different types of cancer cells: normal cells, mutated cells, and tumor cells. The mutated cells are larger than the normal cells. The tumor cells are the largest of the three.","(1) The mutated cells are larger than the normal cells: ""(small) ? normal ? mutated ? (large)"".
(2) The tumor cells are the largest of the three: ""(small) ? normal ? mutated ? tumor (large)"".
(3) Combining (1) and (2) we get the following ordering: ""(small) normal mutated tumor (large)"".
According to this ordering, the cancer cells that are the largest are the tumor cells.
Tumors are a collection of cancer cells. The answer is (C)."
"The following paragraphs each describe a set of three objects arranged in a fixed order. The statements are logically consistent within each paragraph. In a news report, there are three key pieces of information: a prediction of an agricultural disaster, a warning about the impact on employees, and a statement about the overall situation. The prediction of an agricultural disaster is mentioned before the warning about the impact on employees. The statement about the overall situation is mentioned last.Options:(A) The prediction of an agricultural disaster is the first piece of information(B) The warning about the impact on employees is the first piece of information(C) The statement about the overall situation is the first piece of information","(1) The prediction of an agricultural disaster is mentioned before the warning about the impact on employees: ""(first) ? prediction ? warning ? (last)"".(2) The statement about the overall situation is mentioned last: ""(first) ? prediction ? warning situation (last)"".(3) Combining (1) and (2) we get the following ordering: ""(first) prediction warning situation (last)"".
According to this ordering, the first piece of information is the prediction of an agricultural disaster.
The prediction of an agricultural disaster is the first piece of information. The answer is (A)."
"The following paragraphs each describe a set of three objects arranged in a fixed order. The statements are logically consistent within each paragraph. On a shelf, there are three books: a red book, a gray book, and a white book. The white book is to the left of the gray book. The red book is the second from the left.Options:(A) The red book is the leftmost(B) The gray book is the leftmost(C) The white book is the leftmost","(1) The white book is to the left of the gray book: ""(left) ? white ? gray ? (right)"".(2) The red book is the second from the left: ""(left) ? white red gray ? (right)"".(3) Combining (1) and (2) we get the following ordering: ""(left) white red gray (right)"".
According to this ordering, the leftmost book is the white book.
The white book is the leftmost. The answer is (C)."
"The following paragraphs each describe a set of three objects arranged in a fixed order. The statements are logically consistent within each paragraph. In a garden, there are three flower pots: a red pot, a yellow pot, and a blue pot. The blue pot is to the right of the yellow pot. The red pot is the leftmost.Options:(A) The yellow pot is the leftmost(B) The blue pot is the leftmost(C) The red pot is the leftmost","(1) The blue pot is to the right of the yellow pot: ""(left) ? yellow ? blue ? (right)"".(2) The red pot is the leftmost: ""(left) red yellow ? blue ? (right)"".(3) Combining (1) and (2) we get the following ordering: ""(left) red yellow blue (right)"".
According to this ordering, the leftmost pot is the red pot.
The red pot is the leftmost. The answer is (C)."
"The following paragraphs each describe a set of three objects arranged in a fixed order. The statements are logically consistent within each paragraph. In a garden, there are three types of trees: an evergreen, a deciduous, and a palm tree. The evergreen tree is taller than the deciduous tree. The palm tree is the shortest.Options:(A) The evergreen tree is the tallest(B) The deciduous tree is the tallest(C) The palm tree is the tallest","(1) The evergreen tree is taller than the deciduous tree: ""(tall) ? evergreen ? deciduous ? (short)"".(2) The palm tree is the shortest: ""(tall) ? evergreen ? deciduous ? palm (short)"".(3) Combining (1) and (2) we get the following ordering: ""(tall) evergreen deciduous palm (short)"".
According to this ordering, the tallest tree is the evergreen tree.The evergreen tree is the tallest. The answer is (A)."
"""The following paragraphs each describe a set of three objects arranged in a fixed order. The statements are logically consistent within each paragraph. In a school, the number of boys is 10% of the number of girls. What is the ratio of boys to girls in the school?Options:(A) 5:2(B) 2:3(C) 1:2(D) 3:7(E) 2:5""","""(1) The number of boys is 10% of the number of girls: ""let b = number of boys, g = number of girls, then b = 0.1g"".(2) Combining this with the fact that the number of boys is 10% of the number of girls, we get: ""b = 0.1g, therefore b/g = 0.1"".(3) The ratio of boys to girls is the inverse of this, which is 1:10 or 1:2.The answer is (C) 1:2."""
"In a box, there are three different types of cookies: chocolate chip, oatmeal raisin, and peanut butter. The chocolate chip cookies are to the left of the oatmeal raisin cookies. The peanut butter cookies are the rightmost.Options:(A) The chocolate chip cookies are the leftmost(B) The oatmeal raisin cookies are the leftmost(C) The peanut butter cookies are the leftmost","(1) The chocolate chip cookies are to the left of the oatmeal raisin cookies: ""(left) ? chocolate chip ? oatmeal raisin ? (right)"".(2) The peanut butter cookies are the rightmost: ""(left) ? chocolate chip ? oatmeal raisin peanut butter (right)"".(3) Combining (1) and (2) we get the following ordering: ""(left) chocolate chip oatmeal raisin peanut butter (right)"".
According to this ordering, the leftmost cookies are the chocolate chip cookies.
The chocolate chip cookies are the leftmost. The answer is (A)."
"""The following paragraphs each describe a set of three objects arranged in a fixed order. The statements are logically consistent within each paragraph. On a table, there are three rocks: a round rock, a flat rock, and a jagged rock. The flat rock is to the right of the round rock. The jagged rock is the leftmost.Options:(A) The round rock is the leftmost(B) The flat rock is the leftmost(C) The jagged rock is the leftmost""","""(1) The flat rock is to the right of the round rock: ""(left) ? round ? flat ? (right)"".(2) The jagged rock is the leftmost: ""(left) jagged round ? flat ? (right)"".(3) Combining (1) and (2) we get the following ordering: ""(left) jagged round flat (right)"".According to this ordering, the leftmost rock is the jagged rock.The jagged rock is the leftmost. The answer is (C)."""
