input,output
"""There are three objects in a room: a red chair, a blue table, and a green lamp. The blue table is to the right of the red chair. The green lamp is the leftmost object.Options:(A) The red chair is the leftmost(B) The blue table is the leftmost(C) The green lamp is the leftmost""","""(1) The blue table is to the right of the red chair: ""(left) ? red chair ? blue table ? (right)"".(2) The green lamp is the leftmost object: ""(left) green lamp ? red chair ? blue table (right)"".(3) Combining (1) and (2) we get the following ordering: ""(left) green lamp red chair blue table (right)"".According to this ordering, the leftmost object is the green lamp.The green lamp is the leftmost. The answer is (C)."""
"The following paragraphs each describe a set of three objects arranged in a fixed order. The statements are logically consistent within each paragraph. In a zoo, there are three giraffes: Giraffe A, Giraffe B, and Giraffe C. Giraffe C is taller than Giraffe A. Giraffe B is shorter than Giraffe A.Options:(A) Giraffe A is the tallest(B) Giraffe B is the tallest(C) Giraffe C is the tallest","(1) Giraffe C is taller than Giraffe A: ""(tall) ? Giraffe C ? Giraffe A ? (short)"".(2) Giraffe B is shorter than Giraffe A: ""(tall) ? Giraffe A ? Giraffe B ? (short)"".(3) Combining (1) and (2) we get the following ordering: ""(tall) Giraffe C Giraffe A Giraffe B (short)"".
According to this ordering, the tallest giraffe is Giraffe C.
Giraffe C is the tallest. The answer is (C)."
"On a shelf, there are three vases: a blue vase, a red vase, and a yellow vase. The blue vase is to the left of the red vase. The yellow vase is the rightmost.Options:(A) The blue vase is the leftmost(B) The red vase is the leftmost(C) The yellow vase is the leftmost","(1) The blue vase is to the left of the red vase: ""(left) ? blue ? red ? (right)"".(2) The yellow vase is the rightmost: ""(left) ? blue ? red yellow (right)"".(3) Combining (1) and (2) we get the following ordering: ""(left) blue red yellow (right)"".According to this ordering, the leftmost vase is the blue vase.The blue vase is the leftmost. The answer is (A)."
"""The following paragraphs each describe a set of three objects arranged in a fixed order. The statements are logically consistent within each paragraph. In a box, there are three balls: a red ball, a blue ball, and a yellow ball. The blue ball is between the red ball and the yellow ball. The red ball is the leftmost.Options:(A) The red ball is the leftmost(B) The blue ball is the leftmost(C) The yellow ball is the leftmost""","""(1) The red ball is the leftmost: ""(left) ? red ? blue ? yellow ? (right)"".(2) The blue ball is between the red ball and the yellow ball: ""(left) ? red ? blue ? yellow ? (right)"".(3) Combining (1) and (2) we get the following ordering: ""(left) red blue yellow (right)"".According to this ordering, the leftmost ball is the red ball.The red ball is the leftmost. The answer is (A)."""
"The following paragraphs each describe a set of three objects arranged in a fixed order. The statements are logically consistent within each paragraph. On a table, there are three rocks: a granite rock, a limestone rock, and a sandstone rock. The limestone rock is to the right of the granite rock. The sandstone rock is the leftmost.Options:(A) The granite rock is the leftmost(B) The limestone rock is the leftmost(C) The sandstone rock is the leftmost","(1) The limestone rock is to the right of the granite rock: ""(left) ? granite ? limestone ? (right)"".(2) The sandstone rock is the leftmost: ""(left) sandstone granite ? limestone ? (right)"".(3) Combining (1) and (2) we get the following ordering: ""(left) sandstone granite limestone (right)"".
According to this ordering, the leftmost rock is the sandstone rock.
The sandstone rock is the leftmost. The answer is (C)."
"""The following paragraphs each describe a set of three objects arranged in a fixed order. The statements are logically consistent within each paragraph. In a chemistry lab, there are three substances: nitrogen, zinc, and air. Nitrogen is a single element, while zinc and air are composed of multiple elements. The substance that can be separated into several elements is located between the other two substances.Options:(A) Nitrogen is the substance that can be separated into several elements.(B) Zinc is the substance that can be separated into several elements.(C) Air is the substance that can be separated into several elements.""","""(1) Nitrogen is a single element: ""(left) ? nitrogen ? (right)"".(2) Air is composed of multiple elements: ""(left) ? nitrogen air ? (right)"".(3) Zinc is also composed of multiple elements: ""(left) nitrogen zinc ? (right)"".(4) Combining (1), (2), and (3) we get the following ordering: ""(left) nitrogen air zinc (right)"".According to this ordering, the substance that can be separated into several elements is air.Air is the substance that can be separated into several elements. The answer is (C)."""
"The following paragraphs each describe a set of three objects arranged in a fixed order. The statements are logically consistent within each paragraph. In a garden, there are three flowers: a sunflower, a daisy, and a rose. The daisy is to the left of the sunflower. The rose is the rightmost flower.Options:(A) The sunflower is the leftmost flower(B) The daisy is the leftmost flower(C) The rose is the leftmost flower","(1) The daisy is to the left of the sunflower: ""(left) ? daisy ? sunflower ? (right)"".(2) The rose is the rightmost flower: ""(left) ? daisy ? sunflower rose (right)"".(3) Combining (1) and (2) we get the following ordering: ""(left) daisy sunflower rose (right)"".
According to this ordering, the leftmost flower is the daisy.
The daisy is the leftmost flower. The answer is (B)."
"""The following paragraphs each describe a set of three objects arranged in a fixed order. The statements are logically consistent within each paragraph. In a chemistry lab, there are three elements: Element 1, Element 2, and Element 3. Element 2 turns into a liquid when heated. Element 3 turns a greenish color as it sits in air.Options:(A) Element 1 is hammered into a thin sheet(B) Element 2 is ground up into a fine, slippery powder(C) Element 3 is the chemical change""","""(1) Element 2 turns into a liquid when heated: ""(above) ? Element 1 ? Element 2 (liquid) ? Element 3 ? (below)"".(2) Element 3 turns a greenish color as it sits in air: ""(above) ? Element 1 ? Element 2 (liquid) ? Element 3 (greenish) ? (below)"".(3) Combining (1) and (2) we get the following ordering: ""(above) Element 1 Element 2 (liquid) Element 3 (greenish) (below)"".According to this ordering, the chemical change is Element 3 turning a greenish color.Element 3 is the chemical change. The answer is (C)."""
"In a museum, there are three paintings: a landscape painting, a portrait painting, and a still-life painting. The portrait painting is to the right of the landscape painting. The still-life painting is the leftmost.Options:(A) The landscape painting is the leftmost(B) The portrait painting is the leftmost(C) The still-life painting is the leftmost","(1) The portrait painting is to the right of the landscape painting: ""(left) ? landscape portrait ? (right)"".(2) The still-life painting is the leftmost: ""(left) still-life ? landscape portrait ? (right)"".(3) Combining (1) and (2) we get the following ordering: ""(left) still-life landscape portrait (right)"".According to this ordering, the leftmost painting is the still-life painting.The still-life painting is the leftmost. The answer is (C)."
"""The following paragraphs each describe a set of four candles arranged in a fixed order. The statements are logically consistent within each paragraph. Four identical candles are set on a safe surface and lit. One is covered with a small-sized jar, one is covered with a large-sized jar, and one candle is left in the open. A fourth lit candle is placed in a vacuum. Options:(A) The candle placed in the vacuum(B) The candle covered with the small-sized jar(C) The candle covered with the large-sized jar(D) The candle left out in the open""","""(1) The candle placed in the vacuum will have the least amount of oxygen available, causing it to extinguish the quickest. ""(left) ? vacuum ? small jar ? large jar ? open (right)"".(2) The candle left out in the open will have the most oxygen available, allowing it to burn the longest. ""(left) vacuum small jar large jar open (right)"".(3) Combining (1) and (2) we get the following ordering: ""(left) vacuum small jar large jar open (right)"".According to this ordering, the candle that will most likely stay lit the longest is the one left out in the open.The candle left out in the open will most likely stay lit the longest. The answer is (D)."""
"On a shelf, there are three books: a red book, a gray book, and a blue book. The blue book is to the left of the gray book. The red book is the second from the right.Options:(A) The red book is the rightmost(B) The gray book is the rightmost(C) The blue book is the rightmost","(1) The blue book is to the left of the gray book: ""(left) ? blue ? gray ? (right)"".(2) The red book is the second from the right: ""(left) ? ? gray red ? (right)"".(3) Combining (1) and (2) we get the following ordering: ""(left) blue ? gray red (right)"".(4) According to this ordering, the rightmost book is the red book.The red book is the rightmost. The answer is (A)."
"In a park, there are three trees: a tall oak tree, a short pine tree, and a medium-sized maple tree. The maple tree is to the left of the pine tree. The oak tree is the tallest.Options:(A) The pine tree is the shortest(B) The oak tree is the tallest(C) The maple tree is the shortest","(1) The maple tree is to the left of the pine tree: ""(left) ? maple ? pine ? (right)"".(2) The oak tree is the tallest: ""(short) ? pine ? maple ? oak (tall)"".(3) Combining (1) and (2) we get the following ordering: ""(short) pine maple oak (tall)"".
According to this ordering, the shortest tree is the pine tree.
The pine tree is the shortest. The answer is (A)."
"On a shelf, there are three vases: a blue vase, a yellow vase, and a green vase. The yellow vase is to the left of the green vase. The blue vase is the second from the right.Options:(A) The blue vase is the leftmost(B) The yellow vase is the leftmost(C) The green vase is the leftmost","(1) The yellow vase is to the left of the green vase: ""(left) ? yellow ? green ? (right)"".(2) The blue vase is the second from the right: ""(left) ? yellow ? blue green ? (right)"".(3) Combining (1) and (2) we get the following ordering: ""(left) yellow blue green (right)"".According to this ordering, the leftmost vase is the yellow vase.The yellow vase is the leftmost. The answer is (B)."
"""The following paragraphs each describe a set of three objects arranged in a fixed order. The statements are logically consistent within each paragraph. In a garden, there are three types of flowers: bluebells, daffodils, and tulips. The bluebells are barrel-shaped. The daffodils are taller than the bluebells. The tulips are the shortest.Options:(A) The bluebells are the tallest(B) The daffodils are the tallest(C) The tulips are the tallest""","""(1) The bluebells are barrel-shaped: ""(above) ? bluebells ? (below)"".(2) The daffodils are taller than the bluebells: ""(above) ? daffodils ? bluebells ? (below)"".(3) The tulips are the shortest: ""(above) ? daffodils ? bluebells ? tulips (below)"".(4) Combining (1), (2), and (3) we get the following ordering: ""(above) daffodils bluebells tulips (below)"".According to this ordering, the tallest flower is the daffodil.The daffodils are the tallest. The answer is (B)."""
"The following paragraphs describe the spatial arrangement of three Arabic words. The statements are logically consistent within each paragraph. The words are: 'كل', 'أنسان', and 'جواه'. The word 'أنسان' is to the right of the word 'كل'. The word 'جواه' is the rightmost word.Options: (A) The word 'كل' is the leftmost (B) The word 'أنسان' is the leftmost (C) The word 'جواه' is the leftmost","(1) The word 'أنسان' is to the right of the word 'كل': '(left) ? كل ? أنسان ? (right)'. (2) The word 'جواه' is the rightmost word: '(left) ? كل ? أنسان جواه (right)'. (3) Combining (1) and (2) we get the following ordering: '(left) كل أنسان جواه (right)'. According to this ordering, the leftmost word is 'كل'. The word 'كل' is the leftmost. The answer is (A)."
"""The following paragraphs each describe a set of three numbers arranged in a fixed order. The statements are logically consistent within each paragraph. There are three numbers: a prime number, an odd multiple of 5, and the sum of a positive multiple of 2 and a positive multiple of 4. The odd multiple of 5 is between the prime number and the sum of a multiple of 2 and a multiple of 4.Options:(A) The prime number is the smallest(B) The odd multiple of 5 is the smallest(C) The sum of a multiple of 2 and a multiple of 4 is the smallest""","""(1) The odd multiple of 5 is between the prime number and the sum of a multiple of 2 and a multiple of 4: ""(smallest) ? prime ? odd_multiple_of_5 ? sum_of_multiples (largest)"".(2) There are 9 prime numbers less than 26, 3 odd multiples of 5 less than 26, and 10 numbers that are the sum of a positive multiple of 2 and a positive multiple of 4 less than 26.(3) Combining (1) and (2), we can deduce that the prime number is the smallest, the odd multiple of 5 is in the middle, and the sum of a multiple of 2 and a multiple of 4 is the largest.The prime number is the smallest. The answer is (A)."""
"The following paragraphs each describe a set of three objects arranged in a fixed order. The statements are logically consistent within each paragraph. On a shelf, there are three Arabic words: '#الذكرى_الثالثه_الثوره', 'الذكرى', and 'الثالثة'. The word 'الذكرى' is to the right of the hashtag '#الذكرى_الثالثه_الثوره'. The word 'الثالثة' is the leftmost.Options:(A) '#الذكرى_الثالثه_الثوره' is the leftmost(B) 'الذكرى' is the leftmost(C) 'الثالثة' is the leftmost","(1) The word 'الذكرى' is to the right of the hashtag '#الذكرى_الثالثه_الثوره': ""(left) ? '#الذكرى_الثالثه_الثوره' ? 'الذكرى' ? (right)"".(2) The word 'الثالثة' is the leftmost: ""(left) 'الثالثة' ? '#الذكرى_الثالثه_الثوره' ? 'الذكرى' ? (right)"".(3) Combining (1) and (2) we get the following ordering: ""(left) 'الثالثة' '#الذكرى_الثالثه_الثوره' 'الذكرى' (right)"".According to this ordering, the leftmost word is 'الثالثة'.The answer is (C) 'الثالثة' is the leftmost."
"""The following paragraphs each describe a set of three objects arranged in a fixed order. The statements are logically consistent within each paragraph. On a table, there are three vases: a tall vase, a medium vase, and a short vase. The medium vase is to the left of the tall vase. The short vase is the rightmost.Options:(A) The tall vase is the leftmost(B) The medium vase is the leftmost(C) The short vase is the leftmost""","""(1) The medium vase is to the left of the tall vase: ""(left) ? medium ? tall ? (right)"".(2) The short vase is the rightmost: ""(left) ? medium ? tall short (right)"".(3) Combining (1) and (2) we get the following ordering: ""(left) medium tall short (right)"".According to this ordering, the leftmost vase is the medium vase.The medium vase is the leftmost. The answer is (B)."""
"On a table, there are three figurines: a cat, a bird, and a dog. The cat is to the left of the bird. The dog is the rightmost figurine.Options:(A) The cat is the leftmost figurine(B) The bird is the leftmost figurine(C) The dog is the leftmost figurine","(1) The cat is to the left of the bird: ""(left) ? cat ? bird ? (right)"".(2) The dog is the rightmost figurine: ""(left) ? cat ? bird dog (right)"".(3) Combining (1) and (2) we get the following ordering: ""(left) cat bird dog (right)"".
According to this ordering, the leftmost figurine is the cat.
The cat is the leftmost figurine. The answer is (A)."
"""The following paragraphs each describe a set of three numbers arranged in a fixed order. The statements are logically consistent within each paragraph. Set A consists of the integers from 4 to 15, inclusive, while Set B consists of the integers from 7 to 20, inclusive. How many distinct integers belong to both sets at the same time?Options:(A) 5(B) 7(C) 8(D) 9(E) 10""","""(1) Set A consists of the integers from 4 to 15, inclusive: ""(left) ? 4 ? 5 ? 6 ? 7 ? 8 ? 9 ? 10 ? 11 ? 12 ? 13 ? 14 ? 15 ? (right)"".(2) Set B consists of the integers from 7 to 20, inclusive: ""(left) ? 7 ? 8 ? 9 ? 10 ? 11 ? 12 ? 13 ? 14 ? 15 ? 16 ? 17 ? 18 ? 19 ? 20 ? (right)"".(3) Combining (1) and (2) we get the following common integers: 7, 8, 9, 10, 11, 12.(4) Therefore, the number of distinct integers that belong to both sets is 6.According to this, the answer is (D) 9."""
"""On a table, there are three apples: a red apple, a green apple, and a yellow apple. The green apple is to the left of the red apple. The yellow apple is the rightmost.Options:(A) The red apple is the leftmost(B) The green apple is the leftmost(C) The yellow apple is the leftmost""","""(1) The green apple is to the left of the red apple: ""(left) ? green ? red ? (right)"".(2) The yellow apple is the rightmost: ""(left) ? green ? red yellow (right)"".(3) Combining (1) and (2) we get the following ordering: ""(left) green red yellow (right)"".According to this ordering, the leftmost apple is the green apple.The green apple is the leftmost. The answer is (B)."""
"In a garden, there are three flowers: a red rose, a yellow daisy, and a blue iris. The yellow daisy is to the left of the blue iris. The red rose is the second from the right.Options:(A) The red rose is the leftmost flower(B) The yellow daisy is the leftmost flower(C) The blue iris is the leftmost flower","(1) The yellow daisy is to the left of the blue iris: ""(left) ? yellow ? iris ? (right)"".(2) The red rose is the second from the right: ""(left) ? yellow ? rose iris ? (right)"".(3) Combining (1) and (2) we get the following ordering: ""(left) yellow rose iris (right)"".
According to this ordering, the leftmost flower is the yellow daisy.
The yellow daisy is the leftmost flower. The answer is (B)."
"On a table, there are three fruits: an apple, a banana, and an orange. The banana is to the right of the apple. The orange is the leftmost fruit.Options:(A) The apple is the leftmost fruit(B) The banana is the leftmost fruit(C) The orange is the leftmost fruit","(1) The banana is to the right of the apple: ""(left) ? apple ? banana ? (right)"".(2) The orange is the leftmost fruit: ""(left) orange ? apple ? banana ? (right)"".(3) Combining (1) and (2) we get the following ordering: ""(left) orange apple banana (right)"".
According to this ordering, the leftmost fruit is the orange.The orange is the leftmost. The answer is (C)."
"The following paragraphs each describe a set of three objects arranged in a fixed order. The statements are logically consistent within each paragraph. In a geological survey, there are three rock samples: a granite sample, a basalt sample, and a limestone sample. The basalt sample is to the right of the granite sample. The limestone sample is the leftmost.Options:(A) The granite sample is the leftmost(B) The basalt sample is the leftmost(C) The limestone sample is the leftmost","(1) The basalt sample is to the right of the granite sample: ""(left) ? granite ? basalt ? (right)"".(2) The limestone sample is the leftmost: ""(left) limestone ? granite ? basalt (right)"".(3) Combining (1) and (2) we get the following ordering: ""(left) limestone granite basalt (right)"".
According to this ordering, the leftmost rock sample is the limestone sample.
The limestone sample is the leftmost. The answer is (C)."
"The following paragraphs each describe a set of three objects arranged in a fixed order. The statements are logically consistent within each paragraph. In a garden, there are three flower pots: a red pot, a blue pot, and a yellow pot. The blue pot is to the left of the yellow pot. The red pot is the middle pot.Options:(A) The red pot is the leftmost(B) The blue pot is the leftmost(C) The yellow pot is the leftmost","(1) The blue pot is to the left of the yellow pot: ""(left) ? blue ? yellow ? (right)"".(2) The red pot is the middle pot: ""(left) ? blue red yellow ? (right)"".(3) Combining (1) and (2) we get the following ordering: ""(left) blue red yellow (right)"".
According to this ordering, the leftmost pot is the blue pot.
The blue pot is the leftmost. The answer is (B)."
"The following paragraphs each describe a set of three objects arranged in a fixed order. The statements are logically consistent within each paragraph. In a garden, there are three flower pots: a red pot, a blue pot, and a yellow pot. The blue pot is to the right of the red pot. The yellow pot is the leftmost.Options:(A) The red pot is the rightmost(B) The blue pot is the rightmost(C) The yellow pot is the rightmost","(1) The blue pot is to the right of the red pot: ""(left) ? red ? blue ? (right)"".(2) The yellow pot is the leftmost: ""(left) yellow ? red ? blue (right)"".(3) Combining (1) and (2) we get the following ordering: ""(left) yellow red blue (right)"".
According to this ordering, the rightmost pot is the blue pot.
The blue pot is the rightmost. The answer is (B)."
"The following paragraphs each describe a set of three objects arranged in a fixed order. The statements are logically consistent within each paragraph. In a box, there are three fruits: an apple, an orange, and a banana. The orange is to the right of the apple. The banana is the leftmost fruit.Options:(A) The apple is the leftmost fruit(B) The orange is the leftmost fruit(C) The banana is the leftmost fruit","(1) The orange is to the right of the apple: ""(left) ? apple ? orange ? (right)"".(2) The banana is the leftmost fruit: ""(left) banana apple ? orange ? (right)"".(3) Combining (1) and (2) we get the following ordering: ""(left) banana apple orange (right)"".
According to this ordering, the leftmost fruit is the banana.
The banana is the leftmost fruit. The answer is (C)."
"""On a table, there are three items: a red cup, a blue cup, and a green cup. The blue cup is to the right of the red cup. The green cup is the leftmost.Options:(A) The red cup is the rightmost(B) The blue cup is the rightmost(C) The green cup is the rightmost""","""(1) The blue cup is to the right of the red cup: ""(left) ? red ? blue ? (right)"".(2) The green cup is the leftmost: ""(left) green ? red ? blue ? (right)"".(3) Combining (1) and (2) we get the following ordering: ""(left) green red blue (right)"".According to this ordering, the rightmost item is the blue cup.The blue cup is the rightmost. The answer is (B)."""
"The following paragraphs each describe a set of three objects arranged in a fixed order. The statements are logically consistent within each paragraph. There are three numbers: 270, 15, and 405. The difference between 405 and 270 is 15. The missing number is the result of dividing the difference between 405 and 270 minus 15, by a certain number.Options:(A) 24(B) 25(C) 30(D) 39(E) 43","(1) The difference between 405 and 270 is 15: ""(left) ? 405 - 270 ? 15 (right)"".(2) The missing number is the result of dividing the difference between 405 and 270 minus 15, by a certain number: ""(left) ? (405 - 270 - 15) / ? ? (right)"".(3) Combining (1) and (2) we get the following: ""(left) ? 135 / ? ? (right)"".(4) Solving for the missing number, we get: ""? = 135 / 30 = 4.5"".(5) The correct answer is (C) 30."
"The following paragraphs each describe a set of three objects arranged in a fixed order. The statements are logically consistent within each paragraph. In a box, there are three marbles: a blue marble, a red marble, and a green marble. The red marble is to the right of the blue marble. The green marble is the leftmost.Options:(A) The blue marble is the leftmost(B) The red marble is the leftmost(C) The green marble is the leftmost","(1) The red marble is to the right of the blue marble: ""(left) ? blue ? red ? (right)"".(2) The green marble is the leftmost: ""(left) green ? blue ? red ? (right)"".(3) Combining (1) and (2) we get the following ordering: ""(left) green blue red (right)"".
According to this ordering, the leftmost marble is the green marble.
The green marble is the leftmost. The answer is (C)."
"""The following paragraphs each describe a set of three objects arranged in a fixed order. The statements are logically consistent within each paragraph. On a desk, there are three stationery items: a pen, a ruler, and a pair of scissors. The ruler is to the right of the pen. The scissors are the rightmost item.Options:(A) The pen is the leftmost item(B) The ruler is the leftmost item(C) The scissors are the leftmost item""","""(1) The ruler is to the right of the pen: ""(left) ? pen ? ruler ? (right)"".(2) The scissors are the rightmost item: ""(left) ? pen ? ruler scissors (right)"".(3) Combining (1) and (2) we get the following ordering: ""(left) pen ruler scissors (right)"".According to this ordering, the leftmost item is the pen.The pen is the leftmost item. The answer is (A)."""
